{
  "compute_cost_usd": "0.02",
  "customer_id": "cust_acme_corp",
  "ended_at": "2026-05-26T12:40:00.000000+00:00",
  "external_cost_usd": "0.05",
  "failure_count": 0,
  "gpu_cost_usd": "1.80",
  "llm_cost_usd": "0.10",
  "metadata": {
    "agent": "research_agent_v2"
  },
  "network_bytes_in": 10485760,
  "network_bytes_out": 1024,
  "network_call_count": 3,
  "network_cost_usd": "0.03",
  "parent_task_id": null,
  "project_id": "proj_helpdesk_ai",
  "retry_cost_usd": "0.07",
  "retry_count": 1,
  "schema_version": "1",
  "started_at": "2026-05-26T12:30:00.000000+00:00",
  "status": "success",
  "task_id": "11111111-0005-0000-0000-000000000001",
  "task_type": "rag_query",
  "total_cached_tokens": 512,
  "total_cost_usd": "2.00",
  "total_input_tokens": 2150,
  "total_output_tokens": 520
}
