{
  "task_id": "11111111-0004-0000-0000-000000000001",
  "task_type": "minimal_test",
  "status": "success",
  "started_at": "2026-05-26T12:34:00.000000Z",
  "ended_at": "2026-05-26T12:34:30.000000Z",
  "metadata": {},
  "customer_id": null,
  "project_id": null,
  "parent_task_id": null,
  "llm_cost_usd": "0.00",
  "external_cost_usd": "0.00",
  "compute_cost_usd": "0.00",
  "network_cost_usd": "0.00",
  "gpu_cost_usd": "0.00",
  "total_cost_usd": "0.00",
  "total_input_tokens": 0,
  "total_output_tokens": 0,
  "total_cached_tokens": 0,
  "network_bytes_in": 0,
  "network_bytes_out": 0,
  "network_call_count": 0,
  "retry_count": 0,
  "retry_cost_usd": "0.00",
  "failure_count": 0,
  "schema_version": "1"
}
